[
  {
    "company_id":"CORP_001",
    "company_name":"NovaScale AI Systems",
    "ticker":"NVSC",
    "sector":"Technology",
    "sub_sector":"Enterprise AI & Cloud",
    "headquarters":"San Francisco, CA",
    "employee_count":3099,
    "annual_revenue_m":727.55,
    "revenue_velocity_yoy":54.93,
    "revenue_cagr_3yr":33.77,
    "ebitda_m":153.66,
    "net_margin":10.81,
    "debt_to_equity":0.756,
    "current_ratio":3.75,
    "quick_ratio":2.437,
    "altman_z_score":5.48,
    "credit_risk_tier":"Prime \/ Safe Zone",
    "market_cap_m":3386.3,
    "market_cap_tier":"Large Enterprise",
    "event_type":"Capital Raise & Growth Equity",
    "headline":"NovaScale AI Systems Secures $140M in Growth Financing Led by Institutional Tech Investors",
    "signal_sentiment_score":0.9,
    "lead_probability_score":99.9,
    "priority_tier":"Tier 1: Strategic Alpha",
    "qualification_status":"Qualified Target",
    "prospecting_summary":"NovaScale AI Systems presents an institutional Tier-1 target exhibiting robust top-line momentum (54.9% YoY growth) supported by an elite Altman Z-Score of 5.48. Recent catalyst 'NovaScale AI Systems Secures $140M in Growth Financing Led by Institutional Tech Investors' signals active capital allocation toward technology modernization.",
    "market_signals":"Event Catalyst: Capital Raise & Growth Equity (Proceeds will be directly earmarked for scaling sales ops, modernizing data infrastructure...) | Financial Trajectory: YoY Revenue Velocity at 54.9%, FCF at $89.3M | Credit Stance: Altman Z-Score 5.48 (Prime \/ Safe Zone)",
    "talking_points":"\n\u2022 Congratulate executive leadership on recent milestone: 'Capital Raise & Growth Equity', referencing their aggressive 54.9% YoY expansion.\n\u2022 Inquire how their architecture is absorbing surging transaction volumes while maintaining 10.8% net margins.\n\u2022 Propose our benchmark framework to de-risk enterprise rollout and shorten procurement lead-times by 40%.",
    "pitch_angle":"Scalable Enterprise Infrastructure & Rapid Time-to-Value Acceleration",
    "objection_handler":"Prioritizing existing internal engineering bandwidth over external vendors; position as an immediate capability multiplier with zero core-refactoring."
  },
  {
    "company_id":"CORP_002",
    "company_name":"Apex Cloud Dynamics",
    "ticker":"APXC",
    "sector":"Technology",
    "sub_sector":"Hybrid Infrastructure",
    "headquarters":"Austin, TX",
    "employee_count":2153,
    "annual_revenue_m":402.66,
    "revenue_velocity_yoy":19.61,
    "revenue_cagr_3yr":8.79,
    "ebitda_m":60.39,
    "net_margin":10.95,
    "debt_to_equity":1.044,
    "current_ratio":2.23,
    "quick_ratio":0.758,
    "altman_z_score":3.53,
    "credit_risk_tier":"Prime \/ Safe Zone",
    "market_cap_m":1486.57,
    "market_cap_tier":"Mid-Market",
    "event_type":"Executive Leadership Hire",
    "headline":"Apex Cloud Dynamics Appoints Former Enterprise Sales VP as Chief Revenue Officer to Accelerate Global Expansion",
    "signal_sentiment_score":0.85,
    "lead_probability_score":98.4,
    "priority_tier":"Tier 1: Strategic Alpha",
    "qualification_status":"Qualified Target",
    "prospecting_summary":"Apex Cloud Dynamics presents an institutional Tier-1 target exhibiting robust top-line momentum (19.6% YoY growth) supported by an elite Altman Z-Score of 3.53. Recent catalyst 'Apex Cloud Dynamics Appoints Former Enterprise Sales VP as Chief Revenue Officer to Accelerate Global Expansion' signals active capital allocation toward technology modernization.",
    "market_signals":"Event Catalyst: Executive Leadership Hire (Newly appointed CRO brings a mandate to double enterprise institutional contracts and over...) | Financial Trajectory: YoY Revenue Velocity at 19.6%, FCF at $-4.2M | Credit Stance: Altman Z-Score 3.53 (Prime \/ Safe Zone)",
    "talking_points":"\n\u2022 Congratulate executive leadership on recent milestone: 'Executive Leadership Hire', referencing their aggressive 19.6% YoY expansion.\n\u2022 Inquire how their architecture is absorbing surging transaction volumes while maintaining 10.9% net margins.\n\u2022 Propose our benchmark framework to de-risk enterprise rollout and shorten procurement lead-times by 40%.",
    "pitch_angle":"Scalable Enterprise Infrastructure & Rapid Time-to-Value Acceleration",
    "objection_handler":"Prioritizing existing internal engineering bandwidth over external vendors; position as an immediate capability multiplier with zero core-refactoring."
  },
  {
    "company_id":"CORP_003",
    "company_name":"OmniLogix Freight Tech",
    "ticker":"OLFT",
    "sector":"Logistics",
    "sub_sector":"Autonomous Supply Chain",
    "headquarters":"Chicago, IL",
    "employee_count":3330,
    "annual_revenue_m":626.3,
    "revenue_velocity_yoy":66.66,
    "revenue_cagr_3yr":34.41,
    "ebitda_m":161.72,
    "net_margin":12.55,
    "debt_to_equity":0.679,
    "current_ratio":3.15,
    "quick_ratio":2.056,
    "altman_z_score":5.5,
    "credit_risk_tier":"Prime \/ Safe Zone",
    "market_cap_m":5484.98,
    "market_cap_tier":"Large Enterprise",
    "event_type":"Capital Raise & Growth Equity",
    "headline":"OmniLogix Freight Tech Secures $140M in Growth Financing Led by Institutional Tech Investors",
    "signal_sentiment_score":0.9,
    "lead_probability_score":99.9,
    "priority_tier":"Tier 1: Strategic Alpha",
    "qualification_status":"Qualified Target",
    "prospecting_summary":"OmniLogix Freight Tech presents an institutional Tier-1 target exhibiting robust top-line momentum (66.7% YoY growth) supported by an elite Altman Z-Score of 5.50. Recent catalyst 'OmniLogix Freight Tech Secures $140M in Growth Financing Led by Institutional Tech Investors' signals active capital allocation toward technology modernization.",
    "market_signals":"Event Catalyst: Capital Raise & Growth Equity (Proceeds will be directly earmarked for scaling sales ops, modernizing data infrastructure...) | Financial Trajectory: YoY Revenue Velocity at 66.7%, FCF at $105.7M | Credit Stance: Altman Z-Score 5.50 (Prime \/ Safe Zone)",
    "talking_points":"\n\u2022 Congratulate executive leadership on recent milestone: 'Capital Raise & Growth Equity', referencing their aggressive 66.7% YoY expansion.\n\u2022 Inquire how their architecture is absorbing surging transaction volumes while maintaining 12.6% net margins.\n\u2022 Propose our benchmark framework to de-risk enterprise rollout and shorten procurement lead-times by 40%.",
    "pitch_angle":"Scalable Enterprise Infrastructure & Rapid Time-to-Value Acceleration",
    "objection_handler":"Prioritizing existing internal engineering bandwidth over external vendors; position as an immediate capability multiplier with zero core-refactoring."
  },
  {
    "company_id":"CORP_004",
    "company_name":"Vanguard BioPharma",
    "ticker":"VGBP",
    "sector":"Healthcare",
    "sub_sector":"Precision Therapeutics",
    "headquarters":"Boston, MA",
    "employee_count":3281,
    "annual_revenue_m":820.96,
    "revenue_velocity_yoy":62.37,
    "revenue_cagr_3yr":47.97,
    "ebitda_m":244.11,
    "net_margin":23.51,
    "debt_to_equity":0.575,
    "current_ratio":2.9,
    "quick_ratio":1.528,
    "altman_z_score":5.69,
    "credit_risk_tier":"Prime \/ Safe Zone",
    "market_cap_m":4711.9,
    "market_cap_tier":"Large Enterprise",
    "event_type":"Strategic M&A Acquisition",
    "headline":"Vanguard BioPharma Completes Strategic Acquisition of Automated Analytics Platform to Broaden B2B Footprint",
    "signal_sentiment_score":0.78,
    "lead_probability_score":100.0,
    "priority_tier":"Tier 1: Strategic Alpha",
    "qualification_status":"Qualified Target",
    "prospecting_summary":"Vanguard BioPharma presents an institutional Tier-1 target exhibiting robust top-line momentum (62.4% YoY growth) supported by an elite Altman Z-Score of 5.69. Recent catalyst 'Vanguard BioPharma Completes Strategic Acquisition of Automated Analytics Platform to Broaden B2B Footprint' signals active capital allocation toward technology modernization.",
    "market_signals":"Event Catalyst: Strategic M&A Acquisition (Transaction integrates complementary B2B analytics engines, creating urgent demand for ven...) | Financial Trajectory: YoY Revenue Velocity at 62.4%, FCF at $167.1M | Credit Stance: Altman Z-Score 5.69 (Prime \/ Safe Zone)",
    "talking_points":"\n\u2022 Congratulate executive leadership on recent milestone: 'Strategic M&A Acquisition', referencing their aggressive 62.4% YoY expansion.\n\u2022 Inquire how their architecture is absorbing surging transaction volumes while maintaining 23.5% net margins.\n\u2022 Propose our benchmark framework to de-risk enterprise rollout and shorten procurement lead-times by 40%.",
    "pitch_angle":"Scalable Enterprise Infrastructure & Rapid Time-to-Value Acceleration",
    "objection_handler":"Prioritizing existing internal engineering bandwidth over external vendors; position as an immediate capability multiplier with zero core-refactoring."
  },
  {
    "company_id":"CORP_005",
    "company_name":"Titanium Heavy Robotics",
    "ticker":"THRB",
    "sector":"Industrial",
    "sub_sector":"Smart Manufacturing",
    "headquarters":"Detroit, MI",
    "employee_count":3502,
    "annual_revenue_m":660.39,
    "revenue_velocity_yoy":70.75,
    "revenue_cagr_3yr":59.45,
    "ebitda_m":178.23,
    "net_margin":11.34,
    "debt_to_equity":0.41,
    "current_ratio":3.87,
    "quick_ratio":2.2,
    "altman_z_score":6.17,
    "credit_risk_tier":"Prime \/ Safe Zone",
    "market_cap_m":5900.41,
    "market_cap_tier":"Large Enterprise",
    "event_type":"Executive Leadership Hire",
    "headline":"Titanium Heavy Robotics Appoints Former Enterprise Sales VP as Chief Revenue Officer to Accelerate Global Expansion",
    "signal_sentiment_score":0.85,
    "lead_probability_score":99.8,
    "priority_tier":"Tier 1: Strategic Alpha",
    "qualification_status":"Qualified Target",